filename	reference_text	transcribed_text
common_voice_he_42922381	אלא מבטאים גם הישגים בתחומי הספורט והאמנות	אלה מבטאים גם הישגים בתחומי הספורט והאומנות
common_voice_he_41896622	יום הזיכרון הוא יום של משפחת השכול כולה	יום הזיכרון הוא יום של משפחת השכול כולה
common_voice_he_42358470	והם נמצאים במקום הזה לא בהתלהבות ולא בשמחה	והם נמצאים במקום הזה לא בהתלהבות ולא בשמחה
common_voice_he_43313168	אז לצערי אנחנו לא יכולים לעשות הרבה	אז לצערי אנחנו לא יכולים לעשות הרבה
common_voice_he_40977318	העיר הפתוחה אז לפני כשנתיים ומשהו	העיר הפתוחה אז לפני כשנתיים ומשהו
common_voice_he_42402440	הוא אמר אני מחלק סכים פתוחים	הוא אמר אני מחלק סכים פתוחים
common_voice_he_43281947	זו חוויה לא הכי נעימה בעולם	זו חבירה לא הכי נעימה בעולם
common_voice_he_43281958	המספרים שהתפרסמו בתקשורת הם לא נכונים	המספרים שהתפרסמו בתקשורת הם לא נכונים
common_voice_he_42487978	אני רץ למכולת אני לא יכול לדבר	אני רץ למכולת אני לא יכול לדבר
common_voice_he_42487979	שילדים קטנים ובני נוער צורכים סמים	שילדים קטנים ובני נוער צורכים סמים
common_voice_he_41019361	זר הוא תאגיד שהשליטה בו היא בידי זר	זר הוא תאגיד שהשליטה בו היא בידי זר
common_voice_he_41019364	הארכת חיים מצילות חיים מאריכות חיים	הערכת חיים מצילות חיים מאריכות חיים
common_voice_he_41616556	קווי רכבת כמו אשקלון שדרות באר שבע	קווי רכבת כמו אשקלון שדרות באר שבע
common_voice_he_41616557	יהדות התורה מציעה שינוי במדיניות הכלכלית החברתית	יהדות התורה מציעה שינוי במדיניות הכלכלית החברתית
common_voice_he_41616558	מכרסם בזניך במשך שעות תמימות ללא הפסקה	מכרסם באוזניך במשך שעות תמימות ללא הפסקה
common_voice_he_39350850	גם הורדו טיפוליו לרמת קופת חולים	גם הורדו טיפוליו לרמת קופת חולים
common_voice_he_39350851	הטנור שלנו שכח את קולו בביתו	הטנור שלנו שכח את קולו בבית
common_voice_he_39350852	יש שם קבוצה מעורבת מעבריינים מהסוגים השונים	יש שם קבוצה מעורבת מעבריינים מהסוגים השונים
common_voice_he_40630793	קניון הדר הוא נקודת החלפה בין אוטובוסים שונים	קניון הדר הוא נקודת החלפה בין אוטובוסים שונים
common_voice_he_40630794	שבארצות הברית למשל יש בחינה פעם אחת בשנה	כשבארצות הברית למשל יש בחינה פעם אחת בשנה
common_voice_he_40630795	אני לא מכיר מנגנון כזה בשום תחום	אני לא מכיר מנגנון כזה בשום תחום
common_voice_he_41066670	גם החישובים מבחינה פיננסית זה צחוק	גם החישובים מבחינה פיננסית זה צחוק
common_voice_he_41066672	בוא ניתן לזה קצת זמן ונראה איך הדברים מתנהלים	בוא ניתן לזה קצת זמן ונראה איך הדברים מתנהלים
common_voice_he_41066673	מתנהלת בפומבי בבית משפט בדלתיים פתוחות	מתנהלת בפומבי בבית משפט בדלתיים פתוחות
common_voice_he_40858574	שלא זו בלבד שזה לא מביא צמיחה	שלא זו בלבד שזה לא מביא צמיחה
common_voice_he_40858577	הכרה זו אינה פוטרת את הספורטאים משירות	הכרה זו אינה פוטרת את הספורטאים משירות
common_voice_he_40858579	מה ההבדל בין השטח הכבוש שנקרא אוניברסיטת תל אביב	מה ההבדל בין השטח הכבוש שנקרא אוניברסיטת תל אביב
common_voice_he_38283249	ההכנסה היותר גדולה היא ממכירת בולים	ההכנסה היותר גדולה היא ממכירת בולים
common_voice_he_38283250	אהבתי אתכם ספנים היוצאים בשיר זמר תמים	אהבתי אתכם ספנים היוצאים בשיר זמר תמים
common_voice_he_38283253	אנשים יצאו מכאן במקום ספורטאים בעלי חשבון	אנשים יצאו מכאן במקום ספורטאים בעלי חשבון
common_voice_he_41869858	מאמץ מרוכז לאיתור ולהחרמת אמצעי לחימה בלתי חוקיים	מאמץ מרוכז לאיתור ולהחרמת אמצעי לחימה בלתי חוקיים
common_voice_he_41869860	כשממקמים מתקן גז בהיקף כזה בתוך אזור שממילא הוא רווי במפעלים וחומרים מסוכנים	כשממקמים מתקן גז בהיקף כזה בתוך אזור שממלא הוא רווי מפעלים וחומרים מסוכנים
common_voice_he_41869861	באמת תודה רבה לכל אלה ששותפים	באמת תודה רבה לכל אלה ששותפים
common_voice_he_38883182	ואלו מה ששיך לקרע בנפש הרי זה ברור ומובן	ואילו מה ששייך לקרע בנפש הרי זה ברור ומובן
common_voice_he_38883183	הוא לא אלוהי אברהם יצחק ויעקב	ולא אלוהי אברהם יצחק ויעקב
common_voice_he_38883184	עכשיו היא התחילה לתפוס מפני מה הסתלקו להן כל שאר העובדות	עכשיו היא התחילה לתפוס מפני מה הסתלקו להן כל שאר העובדות
common_voice_he_38883186	עשיתי כסף רב והנה באחד הימים הלך כל הכסף לעזאזל בעסק ביש	עשיתי כסף רב והנה באחד הימים הלך כל הכסף לעזאזל בעסק ביש
common_voice_he_41486333	הארנונה בדימונה מוגזמת לעומת ירוחם	הארנונה בדימונה מוגזמת לעומת ירוחם
common_voice_he_41486334	לבין סטודנטים שלמדו כאן באוניברסיטאות בארץ	לבין סטודנטים שלמדו כאן באוניברסיטאות בארץ
common_voice_he_41486336	שמעתי שם הערות מאוד מעניינות לגבי תוכנית ההתנתקות והיציאה מעזה	שמעתי שהמערות מאוד מעניינות לגבי תוכנית ההתנתקות והיציאה מעזה
common_voice_he_41486337	ניסן אסלומינו ואמנון כהן לוועדת הפנים ואיכות הסביבה נתקבלה	ניסן אסלומינו ואמנון כהן לוועדת הפנים ואיכות הסביבה נתקבלה
common_voice_he_40972184	בראשון לציון לא מדובר בעשרים טונות גז	בראיוני ציון לא מדובר בעשרים טונות גז
common_voice_he_40972185	סגניו מאוימים רימונים הושלכו לתוך חצרותיהם	סגניו מאוימים אימונים הושלכו לתוך עוצרותיהם
common_voice_he_40972186	אני מניח שהוא לא מצפה שזה יקרה מחר	אני מניח שהוא לא מצפה שזה יקרה מחר
common_voice_he_40972188	לא רק ברמה העקרונית אלא גם ברמה התפעולית	לא רק ברמה העקרונית אלא גם ברמה התפעולית
common_voice_he_40909673	כי גם כך הוא רעב וממהר	כי גם כך הוא רעב וממהר
common_voice_he_40909674	אנחנו עדים לכך שמקומות יהודיים הם יעד פורענות למפגעים	אנחנו עדים לכך שמקומות יהודיים הם יעד פורענות למפגעים
common_voice_he_40909676	למה היא צריכה לגבות מהם אגרה	למה היא צריכה לגבות מהם אגרה
common_voice_he_40909677	לא אצל המובטלים ולא אצל החרדים	לא יוצא למובטלים ולא יוצא לחרדים
common_voice_he_39897721	בסין יש רכבות מהירות שמגיעות עד ארבע מאות כמש	בסין יש רכבות מהירות שמגיעות עד ארבע מאות קמש
common_voice_he_39897722	והערכים היקרים הם דע מה למעלה ממך	והערכים היקרים הם דע מה למעלה ממך
common_voice_he_39897723	הם לא נעצרו הם לא נשפטו	הם לא נעצרו הם לא נשפטו
common_voice_he_39897724	אנחנו לקראת משהו באלפיים ושלוש עשרה	אנחנו לקראת משהו באלפיים ושלוש עשרה
common_voice_he_43281934	אלא אם כן יש מי שמתנגד	עליהם כן יש מי שמתנגד
common_voice_he_43281935	ואני נמצא פה משנת אלף תשע מאות שמונים ושמונה	ואני נמצא פה משנת אלף תשע מאות שמונים ושמונה
common_voice_he_43281936	ליד כיכר רבין יש את המקום עם הסושי הכי טוב שאכלתי בחיים	ליד כיכר רבין יש את המקום עם הסושי הכי טוב שאכלתי בחיים
common_voice_he_43281938	אבל אני רוצה לוודא סופית שאנחנו באים עם דברים מסודרים	אבל אני רוצה לוודא סופית שאנחנו באים עם דברים מסודרים
common_voice_he_40067774	איגוד ערים ושירותי כבאות אזור אשקלון	איגוד ערים ושירותי כבאות אזור אשקלון
common_voice_he_40067775	מתוקף תפקידי כיושב ראש ועדת הכספים	מתוקף תפקידי כיושב ראש ועדת כספים
common_voice_he_40067777	אבא רץ אתי ביער שאל אבא את אמי היכן כנגלי	אבא רץ איתי ביער ושאל את אמי היכן כנא לך
common_voice_he_40067778	נחקר במשך כשעה ובסיומה שוחרר לדרכו	נחקר במשך כשעה ובסיומה שוחרר לדרכו
common_voice_he_38744643	שחלקם העז למרוד ולהצביע בנושא הערבה ביושר	שחלקם מעז למרוד ולהצביע בנושא הערבה ביושר
common_voice_he_38744644	ולכן כל הטכנולוגיה שאפשר להכניס ולהגביל	ולכן כל הטכנולוגיה שאפשר להכניס ולהגביל
common_voice_he_38744646	המחלקה השביעית של תרבות אבדה עם המורה	המחלקה השביעית של תרבות עבדה עם המורה
common_voice_he_38744647	לעסת החמורים השרתה מנוחה באסם	לעיסת החמורים נשרתה מנוחה באסמה
common_voice_he_38094978	ארכו הלילות וקצרו הימים	ארכו הלילות וקצרו הימים
common_voice_he_38094979	נשכבתי ליד המים השקטים	נשכרתי ליד המים השקטים
common_voice_he_38094980	הרי זה נקרא לקחת חרמש בדיים	הרי זה נקרא לקחת חרמש בידיים
common_voice_he_38094981	המורים לוקחים כרכרות ונוסעים לקראתם	המורים לוקחים כרכרות ונוסעים לקראתן
common_voice_he_39750876	אז מותר לתת גם למפלגה אחרת לנמק	אז מותר לתת גם למפלגה אחרת לנמק
common_voice_he_39750877	אבל היות שהיו שינויים בסדר היום הם היו חייבים לעזוב	אבל היות שהיו שינויים בסדר היום הם היו חייבים לעזוב
common_voice_he_39750878	וזאת הייתה למעשה ראשית השימוש בנעליים	וזאת הייתה למעשה ראשית השימוש בנעליים
common_voice_he_39750933	הרבה פעמים דובר על הנושא הזה	הרבה פעמים דובר על הנושא הזה
common_voice_he_39750937	זה בעצם מהווה תמריץ שלילי לחייל המילואים להתייצב לשירות	זה בעצם מהווה תמריץ שלילי לחייל המילואים להתייצב לשירות
common_voice_he_38883685	ביום בהיר יפה יצאנו לטיול	ביום בהיר יפה יצאנו לטיול
common_voice_he_38883686	כל הבריאים מהלכים כמו קפיצים מתמתחים ומתכווצים מכאבי שרירים	כל הבריאים מהלכים כמו קפיצים מתמתחים ומתכווצים מכאבי שרירים
common_voice_he_38883687	עשן החל להניקנו	ראשן החל להניקנו
common_voice_he_38883688	כבר אפשר לראות שלא מדובר בתוכנית כלכלית	כבר אפשר לראות שלא מדובר בתוכנית כלכלית
common_voice_he_38883689	הוא הרועה שלי	הוא הרועה שלי
common_voice_he_40972199	במפלגתי זה גרוע בקדימה זה גרוע	במפלגתי זה גרוע בקדימה זה גרוע
common_voice_he_40972200	הוא יגיד אני נפגע תאונת דרכים	הוא יגיד אני נפגע תאונת דרכים
common_voice_he_40972201	הוא אומר בתוכנית הזאת החלטנו בצורה ברורה שלא לפגוע בשכבות שנמצאות במצב הקשה ביותר	הוא אומר בתוכנית הזאת החלטנו בצורה ברורה שלא לפגוע בשכבות שנמצאות במצב הקשה ביותר
common_voice_he_40972202	שישולם לטובת הקרן לשיקום ים המלח	שישולם לטובת הקרן לשיקום ים המלח
common_voice_he_40972203	אני חייב לומר לך אני לא שייך למנזר השתקנים	אני חייב לומר לך אני לא שייך למנזר השתקנים
common_voice_he_41617129	בריאת העולם הייתה בזכות מידת החסד עולם חסד ייבנה	בריאת העולם הייתה בזכות מידת החסד עולם חסד ייבנה
common_voice_he_41617130	במכללות הציבוריות יותר משבעים אחוזים מהמרצים הם מרצים מן החוץ	במכללות הציבוריות יותר משבעים אחוזים מהמרצים הם מרצים מן החוץ
common_voice_he_41617131	ובמקומות שבהם הוא הפסיק וציטט בצורה סלקטיבית	ובמקומות שבהם הוא הפסיק וציטט בצורה סלקטיבית
common_voice_he_41617133	והעוזרים לידו דורית אוג סיגל קויוט	והעוזרים לידו דורית אוג סיגל קויוט
common_voice_he_41617137	זה אפשר לתקן כי זה לא מעשי שמים	זה אפשר לתקן כי זה לא מעשי שמיים
common_voice_he_40137979	מה היא ההתחשבות בעמדת קרובי המשפחה	מהי ההתחשבות בעמדת קרובי המשפחה
common_voice_he_40137980	אנו מקווים שהתוכנית תקרום בקרוב עור וגידים	אנו מקווים שהתוכנית תקרום בקרוב אור וגידים
common_voice_he_40137981	יש הרבה מותגים של מכוניות בארץ גונדה וסטראוטיפן למשל	יש הרבה מותגים של מכוניות בארץ גונדה וסיטונאן למשל
common_voice_he_40137982	לא הפרו אמונים ולא קיבלו שוחד	לא הפרו אמונים ולא קיבלו שוחד
common_voice_he_40137983	בין שאדם נפטר בבית בין קרובי משפחה ובין שהוא נפטר ערירי במקום כלשהו	בין שאדם נפטר בבית בין קרובי משפחה ובין שהוא נפטר על ידי במקום כלשהו
common_voice_he_43313116	אנחנו כרגע נמצאים דווקא בארבע עשרה דקות	אנחנו כרגע נמצאים דווקא בארבע עשרה דקות
common_voice_he_43313117	תפעיל את השיר של אביב גפן בספו טיפי	תפעיל את השיר של אביב גחן בספו טיפיי
common_voice_he_43313118	ותוך חמש דקות זה מופיע ברדיו	ותוך חמש דקות זה מופיע ברדיו
common_voice_he_43313119	המוח מורכב משתי אונות הימנית והשמאלית	המוח מורכב משתי עונות הימנית והשמאלית
common_voice_he_43313120	בתוכנית הכלכלית בינתיים גזירה אחת עברה מן העולם	בתוכנית הכלכלית בינתיים גזירה אחת עברה מן העולם
common_voice_he_38568963	כל סמל הוא מועט המרמז להרבה	כל סמל מועט מהרמת בהרבה
common_voice_he_38568964	ומשמתחילים לדבר על הבית העיניים מאירות במין ברק מתגעגע וחולם	ומשמתחילים לדבר על הבית העיניים מהירות במדברת אנרגיה וחוללת
common_voice_he_38568965	כי הדיון בפניו יושהה עד לבירור ההליך הפלילי	שהדיון בפניו יושהה עד לבירור ההליך הפלילי
common_voice_he_38568966	בשעה שדני ואבישי ואיתי ורותי קפצו מעל ערמת הקש עמד יוסי לי מן הצד	בשעה שדני ואבישי ואיתי ברותי כפסו מעל ערימת הקיץ עמד יוסי לימין עצב
common_voice_he_38568967	ראיתיה בעיר הבירה בטרם עליתי ארצה	ראיתי אוויר אווירה בטרם עליתי ארץ
common_voice_he_39659793	אבל הוא ישב לילה שלם במעצר	אבל הוא ישב לילה שלם במעצב
common_voice_he_39659794	הם גם החליטו לשתפו בארכותיהם ועשו קפה משתפת	הם גם החליטו לשתפו בארוחותיהם ועשו קופה משותפת
common_voice_he_39659795	אני מוכרח לומר שאני לא אהסס לעשות מהפכה בתחום התכנון	אני מוכרח לומר שאני לא אהסס לעשות מהפכה בתחום התכנון
common_voice_he_39659796	נצר בני מצות אביך ואל שטת תורת אמך	נצור בני מצוות אביך ואל תיטוש תורת אמך
common_voice_he_39659797	שאנחנו עושים מאמץ כולל עכשיו לשלוט בתוכניות שנכנסות לבתי הספר	שאנחנו עושים מאמץ כולל עכשיו לשלוט בתוכניות שנכנסות לבתי הספר
common_voice_he_40612852	מאיפה הוא בא מה תפיסת עולמו	מאיפה הוא בא מה תפיסת עולמו
common_voice_he_40612855	מצד שני ברדיו מכניסים הפרטה כזאת שספק אם הרדיו הממלכתי יוכל להמשיך להתקיים	מצד שני ברדיו מכניסים הפרטה כזאת שספק אם הרדיו הממלכתי יוכל להמשיך להתקיים
common_voice_he_40612862	מקורה של ההכנסה שחולקה ניהנה ייקבע בהתאם למקורות ההכנסה של הנאמן באופן יחסי	הוראה של ההכנסה שחולקה לנאמן ייקבע בהתאם למקורות ההכנסה של הנאמן באופן יחסי
common_voice_he_40612863	העניין הזה הוא מאה וארבעים מיליון שקל	העניין הזה הוא מאה וארבעים מיליון שקל
common_voice_he_40612866	אולם התגמולים לנזקקים ולנצרכים מותנים מטבע הדברים בהכנסות אחרות	אולם התמלוגים לנזקקים ולנצרכים מותנים מטבע הדברים בהכנסות אחרות
common_voice_he_40612867	אווירת האיפוק והריסון הייתה קצרת מועד	אווירת האיפוק והריסון הייתה קצרת מועד
common_voice_he_41019415	אפילו כאשר הייתה ישיבה של ועדת התכנון בחיפה	אפילו כאשר הייתה ישיבה של ועדת התכנון בחיפה
common_voice_he_41019416	ומשם תהיה פתוחה הדרך לתהליך מדיני היסטורי	ומשם תהיה פתוחה הדרך לתהליך מדיני היסטורי
common_voice_he_41019419	למשל והבן אדם בכלל מתעלם מהבקשה	למשל והבן אדם בכלל מתעלם מהבקשה
common_voice_he_41019455	אמרתי את זה ואמרתי תפתחו את הסרטים ותסתכלו	אמרתי את זה ואמרתי תפתחו את הסרטים ותסתכלו
common_voice_he_41019456	מה טוב חלקנו ומה נעים גורלנו	מה טוב חלקנו ומה נעים גורלנו
common_voice_he_41019457	על מנת לסבר את האוזן אתכבד להביא בפניכם נתונים מספריים מהשטח בהתייחס לציבור הקשישים	על מנת לסבר את האוזן אתכבד להביא בפניכם נתונים מספריים מהשטח בהתייחס לציבור הקשישים
common_voice_he_38623331	זה אפשרי לחיות במחנה פליטים תחת הפצצות	זה אפשרי לחיות במחנה פליטים תחת הפצצות
common_voice_he_38623332	עשרים ותשעה ביוני אלפיים ואחת עשרה למניינם	עשרים ותשע ביוני אלפיים ואחת עשרה למניינם
common_voice_he_38623333	אני צריך לקחת את הכלב שלי לספר	אני צריך לקחת את הכלב שלי לספר
common_voice_he_38623334	הקושי הראשון נוגע למועד עריכת הסדר החוב	הקושי הראשון נוגע למועד עריכת הסדר החוב
common_voice_he_38623347	מי הבשמים שאת משתמשת בהם ריחם משובח	מי המסופים שאת משתמשת בהם ריחם משובח
common_voice_he_38623348	וגם לבית תפילה סרים בוודאי לפעמים בשעת מצב רוח	וגם לבית תפילה שרים בוודאי לפעמים בשעת מצב רוח
common_voice_he_38623349	מאימא מאחי אני מקבלת מכתבים שניהם בריאים	מאימא מאחי אני מקבלת מכתבים שניהם גרועים
common_voice_he_43503033	כחמשת אלפים פועלים מכפר כנא ומהסביבה נזקקים לשירותיה	כחמשת אלפים פועלים מכפר כנא ומהסביבה נזקקים לשירותיה
common_voice_he_43503040	כי הנושא נדון לפני דקות לא רבות במליאה	כי הנושא נדון לפני דקות לא רבות במליאה
common_voice_he_43503045	והכנת תוכנית סדורה לטיפול והסרת לוחות אסבסט פריך בשיתוף פעולה עם המשרד לאיכות הסביבה	והכנת תוכנית סדורה לטיפול והסרת לוחות אסבסט פריך בשיתוף פעולה עם המשרד לאיכות הסביבה
common_voice_he_43503050	זה הנשיא שהטיף ומטיף פעל ופועל	זה הנשיא שהטיף ומטיף פעל ופועל
common_voice_he_43503051	הנושא הזה כבר עלה לפני שבועיים	הנושא הזה כבר עלה לפני שבועיים
common_voice_he_43503055	נערכו השתלמויות מורים לשיפור איכות ההוראה ולהטמעת תוכניות לימודים וחומרי למידה עתירי טכנולוגיות עיליות	נערכו השתלמויות מורים לשיפור איכות ההוראה ולהטמעת תוכניות לימודים וחומרי למידה עתירי טכנולוגיות ידיעות
common_voice_he_43503067	האח הגדול היא תוכנית טלוויזיה פופולרית בערוץ שתיים	האח הגדול היא תוכנית טלוויזיה פופולרית בערוץ שתיים
common_voice_he_43512945	התה ישיבה פה בפגרת הקיץ לפני שנה וחצי	הייתה ישיבה פה בפגרת הקיץ לפני שנה וחצי
common_voice_he_43512961	לא פחות ולא יותר אני בקצבאות ילדים לא אקצץ לעולם	לא פחות ולא יותר אני בקצבאות ילדים לא אקצץ לעולם
common_voice_he_40977316	אוכל יורד ובשט נכנס לקיבה ומתעכל שם אחר כך הוא מועבר למעי הדק והגס	אוכל יורד בוושט נכנס לקיבה ומתאכל שם אחר כך הוא מועבר למי הדק והגס
common_voice_he_40978528	צריך להביא תוכנית בניין עיר תבע	צריך להביא תוכנית בניין עיר אטב
common_voice_he_40978535	ואני רוצה בפתח הדברים למסור את תנחומי	ואני רוצה בפתח הדברים למסור את תנחומיי
common_voice_he_40978542	בדרום תל אביב או בערים החלשות	בדרום תל אביב ובערים החלשות
common_voice_he_40978546	אני יודע מה זה כשהמשטרה חושדת	אני יודע מה זה כשהמשטרה חושדת
common_voice_he_40978553	גיבוש נהלים ופקודות לטיפול והסרת אסבסט פריך	גיבוש נהלים ופקודות לטיפול והסרת אסבסט פריך
common_voice_he_40978560	בן גוריון עשה אותו מעל הכאן הירושלמי	בן גוריון עשה אותו מעל הכאן הירושלמי
common_voice_he_40978567	הישיבה תתקיים ברציפות עד גמר ההצבעה	הישיבה תתקיים ברציפות עד גמר ההצבעה
common_voice_he_40978573	התוכנית הכלכלית שמונחת כאן ועומדת לקריאה שנייה ושלישית	התוכנית הכלכלית שמונחת כאן ועומדת לקריאה שנייה ושלישית
