filename	reference_text	transcribed_text
common_voice_he_41605188	אלא בשימור מרכזי כוח מסוימים במערכות השלטון	אלא בשימור מרכזי כוח מסוימים במערכות השלטון
common_voice_he_41605190	אני בעד חיזוק מזרח ירושלים כולה בכל מקום שבו נימצא	אני בעד חיזוק מזרח ירושלים כולה בכל מקום שבו נמצא
common_voice_he_41605191	אז איך הייתי יכולה לשלם עבור טיפול בחרדה	אז איך הייתי יכולה לשלם עבור טיפול בחרדה
common_voice_he_41605192	כי אפרק תעשייה קיסריה נבנה בשטח ללא שיפוט	כי אפרק תעשייה קיסריה נבנה בשטח ללא שיפוט
common_voice_he_41605193	בפרט בעבירות מין וגם בעניין אלימות	בפרט בעבירות מין וגם בעניין אלימות
common_voice_he_41605194	המופתי הזה עכשיו דיבר נגד הדהוי	המופתי הזה עכשיו דיבר נגד הדהוי
common_voice_he_41605195	והבנתי גם שוועדת החינוך הולכת להתכנס לדיון	והבנתי גם שוועדת החינוך הולכת להתכנס לדיון
common_voice_he_41605196	כדי שבבוא העת כאשר יתבררו העובדות	כדי שבבוא העת כאשר יתבררו העובדות
common_voice_he_41605197	נובמבר ולפעמים מחסנים גם בחודש דצמבר	נובמבר ולפעמים מחסנים גם בחודש דצמבר
common_voice_he_41605199	שכבר מזמן פסקו מלהישמע בהיסטוריה האנושית	שכבר מזמן פסקו מלהישמע בהיסטוריה האנושית
common_voice_he_41605200	כי אי אפשר לגמור עם אי אפשר להכניע עם שלם בכוח הכדורים וברצח ובהרג	כי אי אפשר לגמור עם אי אפשר להכניע עם שלם בכוח הכדורים וברצח ובהרג
common_voice_he_41605201	כתוצאה מהפיצוץ נפצע באורח בינוני המאבטח	כתוצאה מהפיצוץ נפצע באורך בינוני המאבטח
common_voice_he_41605202	עם איזו יוזמה חדשה שמטרתה אחת	עם איזו יוזמה חדשה שמטרתה אחת
common_voice_he_41605203	אני סבור שהנושא מעלה שלל קשיים	אני סבור שהנושא מעלה שלל קשיים
common_voice_he_41605204	המנהיג הלובי מואמר קד אפי ידוע בעמדותיו	המנהיג הלובי מואמר קד אפי ידוע בעמדותיו
common_voice_he_41605205	המחירים עדיין גבוהים ולוקח זמן לטפל בזה	המחירים עדיין גבוהים ולוקח זמן לטפל בזה
common_voice_he_41605206	לא יבואו גויים וזרים בחלקנו ובאדמתנו	לא יבואו גויים וזרים בחלקנו ובאדמתנו
common_voice_he_41605208	אני מניח שגם הוסר ספק לגבי הצבעות ידניות לעתיד הקרוב	אני מניח שגם הוסר ספק לגבי הצבעות ידניות לעתיד הקרוב
common_voice_he_41605209	שגם בה הוא לא ייטול עוד חלק	שגם בה הוא לא טיול עוד חלק
common_voice_he_41605211	אז ירושלים שואלת בצדק למה לא אני	אז ירושלים שואלת בצדק למה לא אני
common_voice_he_41605212	צמצום המגזר הציבורי הקטנת נטל המס	צמצום המגזר הציבורי הקטנת נטל המס
common_voice_he_41605213	בדרך כלל אומרים מה המציעים מציעים	בדרך כלל אומרים מה המציעים מציעים
common_voice_he_41605214	לב יודע מרת נפשו ובשמחתו לא יתערב זר	לב יודע מרת נפשו ובשמחתו לא התערב זר
common_voice_he_39326813	אפרים רוצה אני להגיד משהו	אפרים רוצה אני להגיד משהו
common_voice_he_39326815	משום שבעניינים מן הסוג הזה אין שמש בגבעון דום וירח בעמק איילון	משום שבעניינים מן הסוג הזה אין שמש בגבעון דום וירח בעמק איילון
common_voice_he_39326816	לא ידענו מה לעשות	לא ידענו מה לעשות
common_voice_he_39326817	ראיתי שהחל חי וצוהל לקראת היום הזה היום האחד בכל החורף	ראיתי שהחל חי וצוהל לקראת היום הזה היום האחד בכל החורף
common_voice_he_39326818	ייתכן שאמונתי בכל זאת עמוקה	ייתכן שאמונתי בכל זאת עמוקה
common_voice_he_39326825	אין רואים כלל את הבחור	אין רואים כלל את הבחור
common_voice_he_39326826	עתה אין לי כלום בעולם אין לי דבר	אתה אין לי כלום בעולם אין לי דבר
common_voice_he_39326827	לפני כבשועים גלינו לוח אבן שחקוק עליו בכתב צידוני תרשים של מקדש	לפני כשבועיים גילינו לוח אבן שחקוק עליו בכתב צידוני תרשים של מקדש
common_voice_he_39326828	שאינם נחקקים באופן חוקתי ואשר לעתים קרובות הם הזויים	שאינם נחקקים באופן חוקתי ואשר לעתים קרובות הם הזויים
common_voice_he_39326830	אני אסיים בעוד תוכנית סטירית ראלית	אני אסיים בעוד תוכנית סטירית ראלית
common_voice_he_39326852	התחילה רכיבה במלא מובן המילה	התחילה רכיבה במלוא מובן המילה
common_voice_he_39326853	היהודי הפרטיקולרי הוא היהודי שקיבל תורה מסיני ומקיים מצוות	היהודי הפרטיקולרי הוא היהודי שקיבל תורה מסיני ומקיים מצוות
common_voice_he_39326854	זמן רב לא כתבתי	זמן רב לא כתבתי
common_voice_he_39326855	המורים חשבו כי הרגו את המחלקה	המורים חשבו כי הרגנו את המחלקה
common_voice_he_39326856	בוא אחרי לחפירות כלם משתגעים משמחה	בוא אחריי לחפירות כולם משתגעים משמחה
common_voice_he_39326862	זר אני לאנשים אולם קרוב אני לאדמה	זר אני לאנשים אולם קרוב אני לאדמה
common_voice_he_39326863	אבל לפעמים אני חושבת שהייתי יכולה לנצל שנה זו ללימודים יותר חשובים	אבל לפעמים אני חושבת שהייתי יכולה לנצל שנה זו ללימודים יותר חשובים
common_voice_he_39326864	תנו לו לדבר לכל הרוחות	תנו לו לדבר לכל הרוחות
common_voice_he_39326865	אין מלים בפי למסור את ההרגשות שעוררו בי הדרך והאוטובוס לעמק	אין מילים בפי למסור את הרגשות שעוררו בי הדרך והאוטובוס לעמק
common_voice_he_39326866	והבעיה הקשה היא שהוא השחקן החזק ביותר	והבעיה הקשה היא שהוא השחקן החזק ביותר
common_voice_he_39327003	ולחדול מספינים פוליטיים נכלוליים לשינוי שיטת הממשל	ולחדול מספינים פוליטיים נכלוליים לשינוי שיטת הממשל
common_voice_he_39327004	אין הוא יכול לחכות יותר	אין הוא יכול לחכות יותר
common_voice_he_39327005	הרי אין דוגמה אחת בעולם לכך שבזמן מיתון הורדת מסים יצרה צמיחה	הרי אין דוגמה אחת בעולם לכך שבזמן מיתון הורדת מיצים יצרה צמיחה
common_voice_he_39327006	כל האחים במשפחה נראים כמו תאומים אחד של השני	כל האחים במשפחה נראים כמו תאומים אחד של השני
common_voice_he_39327007	מה שקורה בספרד מה שקורה באיטליה	מה שקורה בספרד מה שקורה באיטליה
common_voice_he_39327020	זה הקושי היחידי היחידי כן סבורה אני	זה הקושי היחידי היחידי כן סבורה אני
common_voice_he_39327022	אולי נלך לעשות איזה טיול קצר בנחל	אולי נלך לעשות איזה טיול קצר בנחל
common_voice_he_39327024	לי לא שיחק המזל באמריקה כלום אתה יודע עם מי הנך מדבר	לי לא שיחק המזל באמריקה כלום אתה יודע עם מינך מדבר
common_voice_he_39327025	כאשר עמדנו מול יתרון בכמויות הנשק והחיילים	כאשר עמדנו מול יתרון בכמויות הנשק והחיילים
common_voice_he_39327027	אנחנו רוצים לאפשר לפלסטינים חופש פולחן בהר הבית	אנחנו רוצים לאפשר לפלסטינים חופש פולחן בהר הבית
common_voice_he_39327033	חמוציות זה לאירועים מיוחדים	חמוציות זה לאירועים מיוחדים
common_voice_he_39327038	אך איש לא יפנה מבטו אל עברי	אך איש לא יפנה מבטו אל עברי
common_voice_he_39327040	כל שנה הביאה לו פרחים יפהפים	כל שנה הביאה לו פרחים יפהפים
common_voice_he_39327041	מן טבריה העיר ועד לדרך הצדדית המתרוממת לבין ההרים שבתוכם שכן הכפר	מן טבריה העיר ועד לדרך הצדדית המתרוממת לבין הערים שבתוכם שכן הכפר
common_voice_he_39327047	הוא מוביל אותי לצד הנהר השקט	הוא מוביל אותי לצד הנהר השקט
common_voice_he_39327048	מפני רגע זה אני פוחדת מאוד מודה אני בגלוי	מפני רגע זה אני פוחדת מאוד מודה אני בגלוי
common_voice_he_39327049	בוא אתי בוא אתי	בוא איתי בוא איתי
common_voice_he_39327050	שלוש עשרה מועצות מקומיות וארבע עיריות	שלוש עשרה מועצות מקומיות וארבע עיריות
common_voice_he_39327051	התוכנית הזאת עדיין לא נכנסה כלל לתוקף	התוכנית הזאת עדיין לא נכנסה כלל לתוקף
common_voice_he_39327063	זורחים עוד כוכבים	זורחים עוד כוכבים
common_voice_he_39327065	אתה צריך להבין כי אין האנשים המחפשים יהלומים כשאר בני האדם	אתה צריך להבין כי אין האנשים המחפשים יהלומים כשאר בני אדם
common_voice_he_39327066	פתאום התעורר כולו נפחד כשידו האחת מגרדת את החזה ושואל מה השעה	פתאום התעורר כולו נפחד כשידו האחת מגרדת את החזה ושואל מה השעה
common_voice_he_39327068	אין גויים בארץ ישראל אמר אמנון ואין אנו מפחדים מפני גויים	אין גויים בארץ ישראל אמר אמנון ואין אנו מפחדים מפני גויים
common_voice_he_39327081	ואני רוצה לתת דוגמה ממכתב שהונח על שולחני היום	ואני רוצה לתת דוגמה ממכתב שהונח על שולחני היום
common_voice_he_39327082	אני אומרת תמיד שלא וזאת אמת	אני אומר את תמיד שלא וזאת אמת
common_voice_he_39327084	מכיוון שאני כותבת יומן וליומן מתאים לכתוב על ענייני בחורים אכתוב חדשות	מכיוון שאני כותב את יומן וליומן מתאים לכתוב על ענייני בחורים אכתוב חדשות
common_voice_he_39327085	כי הוא קיים בהיקפים רחבים ביותר	כי הוא קיים בהיקפים רחבים ביותר
common_voice_he_39327091	אפילו לי שאני רק חדשים אחדים חיה בצורה זו	אפילו לי שאני רק חודשים אחדים חיה בצורה זו
common_voice_he_39327092	והבהרתי שהכוונה היא לייצר מסגרת קבועה	והבהרתי שהכוונה היא לייצר מסגרת קבועה
common_voice_he_39327093	כן כפשתי יהלומים	כן חיפשתי יהלומים
common_voice_he_39327094	חדר שהמים דולפים בו בארבעה מקומות	חדר שהמים דולפים בו בארבעה מקומות
common_voice_he_39327095	כל הלילה ישבנו בתוך היער הוסיף יוסי לי לספר	כל הלילה ישבנו בתוך היער הוסיף יוסי לי לספר
common_voice_he_39327096	יש חכמים הנשמרים מסמלים	יש חכמים הנשמרים מסמלים
common_voice_he_39327097	וזה כמעט נכון הן תמיד חייתי בין יהודים	וזה כמעט נכון הן תמיד חייתי בין יהודים
common_voice_he_39327098	אתמול הייתה בביתנו חנוכת חדר הקריאה	אתמול הייתה בביתנו חנוכת חדר הקריאה
common_voice_he_39327099	נכנסנו למסעדה ואכלנו שם ארוחת בוקר	נכנסנו למסעדה ואכלנו שם ארוחת בוקר
common_voice_he_39327100	לדני קראו דין דין דני	לדני קראו דין דין דני
common_voice_he_39327103	המורים יוצאים מחוץ לעיר ומחפשים	המורים יוצאים מחוץ לעיר ומחפשים
common_voice_he_39327105	הוא פגע רק בבשר והעור אשר עליו מוצק היה	הוא פגע רק בבשר והעור אשר עליו מוצק היה
common_voice_he_39327107	זה אושר גדול לראות אתכם	זה אושר גדול לראות אתכם
common_voice_he_39327109	מה הבשורה תחת השמים	מה הבשורה תחת השמיים
common_voice_he_39327110	והיקף השטח הפתוח בה קטן בהרבה מהסטנדרטים הבין לאומיים הקיימים	והיקף השטח הפתוח בה קטן בהרבה מהסטנדרטים הבינלאומיים הקיימים
common_voice_he_39327112	הריהו מדבר בשפת סוסים	הרי הוא מדבר בשפת סוסים
common_voice_he_39327118	אין אני בטוח כל עיקר שראוי אני לכך	אין אני בטוח כל עיקר שראוי אני לכך
common_voice_he_39327119	כל המחלקות חייבות לגשת במרץ לעבודה ולהשתדל בכל הכוחות להגדיל את חלקן	כל המחלקות חייבות לגשת במרץ לעבודה ולהשתדל בכל הכוחות להגדיל את חלקן
common_voice_he_39327120	בנשימה אחת כמו פרה	בנשימה אחת כמו פרה
common_voice_he_39327121	סיפרה שאתה ובת דודך רוצים לנסוע הביתה	סיפרה שאתה ובת דודך רוצים לנסוע הביתה
common_voice_he_39327123	ועם כל זה היא כותבת מאמרים ורק זה מעניין אותה	ועם כל זה היא כותבת מאמרים ורק זה מעניין אותה
common_voice_he_39327124	כשתצא מכאן שוב אשאר לבדי	כשתצא מכאן שוב אשאר לבדי
common_voice_he_39327125	נבקש לציין כי במקרים מתאימים תיבחן גם האפשרות לעתור למעצר ממש עד תום ההליכים	נבקש לציין כי במקרים מתאימים תיבחן גם האפשרות לעתור למעצר ממש עד תום ההליכים
common_voice_he_39327126	מצאנו את הלוח	מצאנו את הלוח
common_voice_he_39327137	איני רוצה איני יכול	איני רוצה איני יכול
common_voice_he_39327138	אם תסכימו הריני מוכן לעשות בקור קצר בחדרו	אם תסכימו הריני מוכן לעשות ביקור קצר בחדרו
common_voice_he_39327139	מה טוב היה לי לו יכולתי להאמין	מה טוב היה לי לו יכולתי להאמין
common_voice_he_39327140	כל השאר אינו ולא כלום לעומת קושי זה	כל השאר אינו ולא כלום לעומת קושי זה
common_voice_he_39327141	כל מה שטיפחתי בעומק לבי בשנה האחרונה אין להם עדיין יסוד איתן	כל מה שטיפחתי בעומק לבי בשנה האחרונה אין להם עדיין יסוד איתן
common_voice_he_39327147	גם כי יזקין לא יסור ממנה	גם כי הזקין לא יסור ממנה
common_voice_he_39327148	יש לנו הרבה מה לומר בהקשר של אותם נושאים שמופקדים בידי משטרת ישראל	יש לנו הרבה מה לומר בהקשר של אותם נושאים שמופקדים בידי משטרת ישראל
common_voice_he_39327151	הארץ שעל ידי חיים כאלה עומדת להיבנות	הארץ שעל ידי חיים כאלה עומדת להיבנות
common_voice_he_39327152	מובן שלא בין יהודים כאלה חופשיים עמלים שקטים ולדעתי גם מאושרים	מובן שלא בין יהודים כאלה חופשים עמלים שקטים ולדעתי גם מאושרים
common_voice_he_39327181	וכך בכל פעם יש איזה שינוי	וכך בכל פעם יש איזה שינוי
common_voice_he_39327182	השעה כעת היא שתים וחצי לאחר חצות	השעה כעת היא שתיים וחצי לאחר חצות
common_voice_he_39327183	מול ארגז הגזירות המיושן הזה שעכשיו מטילים לפתחנו	מול ארגז הגזרות המיושן הזה שעכשיו מניתים לפתחנו
common_voice_he_39327184	יפה מאוד	יפה מאוד
common_voice_he_39327185	רק יוסי לי עמד כשעיניו פקוחות ומזהירות ופיו אינו פוסק מלמלמל	רק יוסי לי עמד כשעיניו פקוחות ומזהירות ופיו אינו פוסק מלמלמל
common_voice_he_39327196	ובאמת הלכנו ולא ידענו לאן	ובאמת הלכנו ולא ידענו לאן
common_voice_he_39327197	שתהליך חינוכי להפחתת האלימות הוא מאמץ יומיומי מתמשך וארוך טווח	שתהליך חינוכי להפחתת האלימות הוא מאמץ יומיומי מתמשך וארוך טווח
common_voice_he_39327198	ולא זכרו בני ישראל את יהוה אליהם המציל אותם מיד כל אביהם מסביב	ולא זכרו בני ישראל את ה אלוהיהם המציל אותם מיד כל אויביהם מסביב
common_voice_he_39327199	הכלבה הביאה לאור העולם שני גורים	הכלבה הביאה לאור העולם שני יגורים
common_voice_he_39327200	ובעת רחמים בין השמשות	ובעת רחמים בין השמשות
common_voice_he_39327214	במקום לקחת גדר ביטחונית במקום שמפריד ועוצר טרוריסטים	במקום לקחת גדר ביטחונית במקום שמפריד ועוצר טרוריסטים
common_voice_he_39327215	אומרים אהבה יש בעולם מה זאת אהבה	אומרים אהבה יש בעולם מה זאת אהבה
common_voice_he_39327216	אם השערתו של הנורווגי נכונה היא הריני מציע את עצמי לעזרתך	אם השערתו של הנורווגי נכונה היא הריני מציע את עצמי לעזרתך
common_voice_he_39327217	אם לא גמלת עלי את החסד	אם לא גמלת עלי את החסד
common_voice_he_39327218	התה לנו אספה קצרה וכולנו הסכמנו ללכת למורד	הייתה לנו אספה קצרה וכולנו הסכמנו ללכת למורד
common_voice_he_39642806	מגיעים לתוצאות ומגיעים לתוצאות טובות ומעולות	מגיעים לתוצאות ומגיעים לתוצאות טובות ומעולות
common_voice_he_39642807	בקריאת מכתב שקיבלתי כאשר ביקרתי בנצרים	בקריאת מכתב שקיבלתי כאשר ביקרתי בנצרים
common_voice_he_39642808	חלק גדול מהם לא נמצאים כאן	חלק גדול מהם לא נמצאים כאן
common_voice_he_39642809	הדין של ירושלים לא ייחרץ על ידי קבוצה פרובוקטיבית ומתוסכלת זו	הדין של ירושלים לא ייחרץ על ידי קבוצה פרובוקטיבית ומתוסכלת זו
common_voice_he_39642810	לא רק השכבות החלשות ייפלו בו ויסבלו ממנו	לא רק השכבות החלשות יפלו בו ויפסלו ממנו
common_voice_he_39642811	זה לא מתחיל מזה שלא גובים ארנונה	זה לא מתחיל מזה שלא גובים ארנונה
common_voice_he_39642813	כי אם זה תלוי בחלק מהיושבים פה	כי אם זה תלוי בחלק מהיושבים פה
common_voice_he_39642814	אז יקרה משהו או לא יקרה משהו	אז יקרה משהו או לא יקרה משהו
common_voice_he_39642815	אז מה מצפים שנחשוב לגבי הזקנים	אז מה מצפים שנחשוב לגבי הזקנים
common_voice_he_39642817	ואפילו כפרים ערביים שנופלים בקטגוריה הזאת הוצאו מהרשימה	ואפילו כפרים ערביים שנופלים בקטגוריה הזאת הוצאו מהרשימה
common_voice_he_39642818	אבל היא תדבר במשך שבע דקות	אבל היא תדבר במשך שבע דקות
common_voice_he_39642819	אז היזומה להקמת היחידה היא מפוארת	אז היזומה להקמת היחידה היא מפוארת
common_voice_he_39884492	הרי הוא צמח בשכונה יד בבאר שבע	הרי הוא צמח בשכונה יד בבאר שבע
common_voice_he_38078769	רק הלבנה והכוכבים האירו את הדרך	רק הלבנה והכוכבים האירו את הדרך
common_voice_he_38078770	אף איש לא זז ממקומו	אף איש לא זז ממקומו
common_voice_he_38078771	יש פה חומר מגוון מאד של ספרים כי רוב האנשים הביאו משהו	יש פה כומר מגוון מאוד של ספרים כי רוב האנשים הבינו משהו
common_voice_he_38078772	כמה צעיר אתה	כמה צעיר אתה
common_voice_he_38078773	כוכבי שמים זה עם זה סכים	כאבי שמיים זה עם זה סכין
common_voice_he_38078774	גו כמה קשה לכתוב עוד הכול	או כמה קשה לכתוב עוד הכל
common_voice_he_38078776	כי אחרי הכל נקשרים למקום ולאנשים מבדה שקשה לתארה בשעה שאת נמצאת בו	כי אחרי הכל נקשרים למקום ואנשים במידה שקשה לטהרה בשעה שאת מוצאת
common_voice_he_38078777	אני אוהבת את הארץ או יותר נכון אני רוצה לאהוב	אני אוהבת את הארץ ויותר נכון אני רוצה להראות
common_voice_he_38078778	אני הייתי שם באמריקה שלך	אני הייתי שם באמריקה שלך
common_voice_he_38078779	תהא זו היצירה העמוקה והמקורית ביותר בדורה	תהיה זו הישירה העמוקה והמקורית ביותר בזורה
common_voice_he_38078780	בסופו של דבר לאחר שיבשו הדמעות הרגשתי שבכל זאת היטבתי שעות	בסופו של דבר לאחר שיבשו הדמעות הרגשתי שבכל זאת חיטבתי לעשות
common_voice_he_38078781	אמר המורה שאיזה ילד ילך אתיה הביתה	אמר המורה שהילד ילך אתיה הביתה
common_voice_he_38078782	למרות שהתאריך הזה ראש השנה האזרחי אינו מקובל בארץ כראש השנה	למרות שתאריק הזה ראש השנה האזרחי אינו מקובל בארץ כראש השנה
common_voice_he_38078783	רוח צוננת חדה השתוללה ברחובות	רוח סוכננו חטא השתוללה בכלבות
common_voice_he_38078784	ומשפחה שהכנסתה גבוהה תשלם מס על הקצבאות	למשפחה שהכנסתה גבוה תשלם מס על הקצבאות
common_voice_he_38078785	פה בבית ספר בכל מקום את החופש את האנושיות	הוא בבית ספר בכל מקום את החופש את האנושיות
common_voice_he_38078786	מוחק אחת ומצייר אחרת במקומה	מוחק אחת מצייר אחרת במקומה
common_voice_he_38078787	חתול דע לך לעולם אינו ניזוק בנפילה	חתול דע לך לעולם אלו נזעקו ונטילה
common_voice_he_38085633	צמרות העצים נעו בעדינות ברוח החמימה	שמורות העצים נעו בעדינות לרוח החמימה
common_voice_he_38085634	על עבודתי חיי יום יום אני כותבת הביתה	על עבודתי חיי יום יום אני כותבת הביתה
common_voice_he_38085635	הקיר הזה לבן מדי	הקיר הזה לבן מדי
common_voice_he_38085636	עם הרים ועמקים עטופי דשא	אין הרים ועמקים עטופי דשא
common_voice_he_38085637	אדע אותה בזמן הקרוב	אידה אותה בזמן הקלוף
common_voice_he_38085643	עומד לרדת גשם	עומד לרדת גשם
common_voice_he_38085644	לפי דעתי הרי טוב שמצאת אגרת זו	לפי דעתי הרי טוב שמצאת יגאל את זה
common_voice_he_38085645	כשחזרתי ראיתי בחלון בתחנה המרכזית את החטא עונשו	כשחדרתי ראיתי בחלון בתקנה המרכזית את החטא והונו
common_voice_he_38085646	הגגון של תבן והחלונות קטנים	הגאול של שדה בל בחלונות קטנים
